Chat Started,Customer,Number,Enquiry,Location,Assigned To
2026-06-10 09:12,Suresh Babu,+91 90000 11122,"Interested in 2BHK, budget around 60L, wants site visit this weekend",Whitefield Bangalore,ramesh@growEasy.com
2026-06-10 10:45,Fathima Beevi,+91 90000 11133,Asked pricing for corner plot in Sarjapur,Sarjapur,ramesh@growEasy.com
2026-06-11 08:30,Unknown,,Sent a hi and never replied again,Unknown,ramesh@growEasy.com
2026-06-11 14:20,Deepak,90000 11144,Wants NRI payment options for Meridian Tower,Mumbai NRI,ramesh@growEasy.com
2026-06-12 16:05,Lakshmi Narayan,+91-90000-11155 (also reachable on +91-90000-11166),Confirmed booking token paid 50000,Eden Park,ramesh@growEasy.com
